{
  "schema_version": 1,
  "manual_id": "manual04-nist-ai-600-1",
  "manual_root": "01-foundations/NIST_AI_600-1_Generative_AI_Profile",
  "expected_chapters": 32,
  "languages": {
    "en": {
      "source_globs": ["English/source/*.md","MANUAL_04_IMPLEMENTATION_PATHS.md"],
      "required_terms": ["NIST AI 600-1"],
      "chapter_heading_pattern": "^#\\s+(\\d+)\\.",
      "artifacts": {
        "docx": "publication/Manual_04_NIST_AI_600-1_Generative_AI_Profile_EN.docx",
        "pdf": "publication/Manual_04_NIST_AI_600-1_Generative_AI_Profile_EN.pdf"
      }
    },
    "es-419": {
      "source_globs": ["es-419/source/*.md"],
      "required_terms": ["NIST AI 600-1"],
      "chapter_heading_pattern": "^#\\s+(\\d+)\\.",
      "artifacts": {
        "docx": "publication/Manual_04_NIST_AI_600-1_Generative_AI_Profile_ES-419.docx",
        "pdf": "publication/Manual_04_NIST_AI_600-1_Generative_AI_Profile_ES-419.pdf"
      }
    },
    "pt-BR": {
      "source_globs": ["pt-BR/source/*.md"],
      "required_terms": ["NIST AI 600-1"],
      "chapter_heading_pattern": "^#\\s+(\\d+)\\.",
      "artifacts": {
        "docx": "publication/Manual_04_NIST_AI_600-1_Generative_AI_Profile_PT-BR.docx",
        "pdf": "publication/Manual_04_NIST_AI_600-1_Generative_AI_Profile_PT-BR.pdf"
      }
    }
  },
  "publication_report": "publication/qa/MANUAL_04_PUBLICATION_REPORT.json",
  "checksum_manifest": "publication/qa/MANUAL_04_SHA256SUMS.txt",
  "page_qa": "publication/qa/MANUAL_04_PAGE_QA.csv",
  "review_records": [
    {"path":"qa/LOCALIZATION_SEMANTIC_REVIEW_GATE.md","required_markers":["PASS"]},
    {"path":"qa/DOCUMENT_ACCESSIBILITY_PUBLICATION_QA_GATE.md","required_markers":["PASS"]}
  ],
  "release_controls": {
    "require_report_hash_match": true,
    "require_checksum_match": true,
    "require_docx_integrity": true,
    "require_pdf_integrity": true,
    "require_page_qa_pass": true,
    "require_stale_artifact_check": true,
    "require_roundtrip": true,
    "require_accessibility": true
  }
}
